{"status":"safe_unavailable","reason_code":"missing_authority_metadata","user_safe_explanation":"Flora cannot safely present this object because the governed source does not provide enough authority metadata.","technical_reference":"owner=TBD for BK-ENT-001 in Banking manifest; do not invent canonical owner.","affected_object_id":"BK-ENT-001","affected_asset_id":"BK-ENT-001","correlation_id":"corr-synthetic-missing-authority-001","retryable":false,"recommended_next_action":"Inspect source governance metadata or request owner-authority completion outside Increment 1.","audit_event_reference":"aud-synthetic-001"}
