{"status":"safe_unavailable","reason_code":"identifier_unresolved","user_safe_explanation":"Flora cannot safely present the requested relationship because the target identity is unresolved.","technical_reference":"Relationship target uses a prose label without a governed target object_id.","affected_object_id":"navigation persona set not separately canonicalised","affected_asset_id":"BK-FLR-SSN-SPEC-001","correlation_id":"corr-synthetic-unresolved-001","retryable":false,"recommended_next_action":"Resolve the target through the temporary identity resolution envelope before display.","audit_event_reference":"aud-synthetic-002"}
